Task Name,Department,Description,Assigned Role,Due Date,Priority,Dependencies,Task Status
Cinematic Voiceover Integration,Programming,"Sync recorded voiceover lines with cutscene animations and ensure proper lip-sync (if applicable).",Audio Programmer,2024-10-15,Medium,Record Voiceovers (Story Dialogue),Open
Cutscene Polish and Effects,Art,"Add special effects to cutscenes (dramatic lighting, particle effects for magic) and polish camera transitions.",VFX Artist,2024-10-20,Medium,"Implement Cutscene in Engine – Intro; Implement Cutscene in Engine – Ending",Open
Narrative Consistency Review,QA,"Play through story cutscenes and sequences to ensure narrative consistency and that VO matches subtitles.",QA Tester,2024-10-30,Medium,"Implement Cutscene in Engine – Intro; Record Voiceovers (Story Dialogue)",Open
Alpha Feature Integration Freeze,Production,"Set a deadline where all core features must be integrated into the game; beyond this, focus is on refinement.",Project Manager,2024-10-31,Critical,"Implement Sound in Engine; Implement Menu UI; Implement Cutscene in Engine – Ending",Open
Combine and Integrate Core Features,Production,"Ensure all major systems (combat, AI, UI, sound, cinematics) are integrated into a single build for testing.",Build Engineer,2024-11-10,Critical,Alpha Feature Integration Freeze,Open
First Playable Internal Demo,QA,"Produce a first playable version of the game (alpha) and distribute internally for team playtesting.",Project Manager,2024-11-15,High,Combine and Integrate Core Features,Open
Internal Playtesting Session 1,QA,"Conduct an internal playtesting session focusing on early levels; gather feedback on gameplay and bugs.",QA Lead,2024-11-20,High,First Playable Internal Demo,Open
Log and Triage Playtest Feedback,QA,"Collect feedback/bug reports from playtest and categorize issues (gameplay, bugs, difficulty, etc.) for action.",QA Lead,2024-11-25,Critical,Internal Playtesting Session 1,Open
Adjust Level Difficulty (Alpha Pass),Level Design,"Tweak enemy counts, placement, and puzzle difficulty in early levels based on playtest feedback.",Level Designer,2024-12-05,High,Log and Triage Playtest Feedback,Open
Refine Player Combat Feel,Game Design,"Adjust combat parameters (animation timing, input responsiveness, damage output) to improve feel.",Combat Designer,2024-12-05,Critical,Log and Triage Playtest Feedback,Open
AI Behavior Refinement (Alpha),Programming,"Improve AI decision-making and responsiveness; fix any alpha-phase AI bugs or weird behaviors.",AI Programmer,2024-12-10,High,Internal Playtesting Session 1,Open
Implement Additional Combat Moves,Game Design,"Add any new combat moves or abilities identified during playtesting to enhance gameplay variety.",Combat Designer,2024-12-15,Medium,Log and Triage Playtest Feedback,Open
Optimize Rendering Performance (Alpha),Programming,"Profile game performance in alpha and optimize rendering (LOD adjustments, culling, shader optimizations).",Engine Programmer,2024-12-20,Critical,First Playable Internal Demo,Open
Optimize Memory and Load Times,Programming,"Optimize asset loading and memory usage to reduce load times and prevent memory-related crashes.",Engine Programmer,2024-12-20,High,First Playable Internal Demo,Open
Multiplayer Prototype (If Applicable),Programming,"If game has co-op or online, create a prototype to test basic connectivity and synchronization.",Network Programmer,2024-12-31,Low,Combine and Integrate Core Features,Open
Implement Save/Load System,Programming,"Develop the system to save and load game progress, including checkpoints and player stats.",Systems Programmer,2024-11-30,High,Combine and Integrate Core Features,Open
Integrate Achievements/Trophies,Programming,"Implement achievement tracking and triggers for platform achievements/trophies.",Systems Programmer,2025-01-15,Low,Implement Save/Load System,Open
Polish Character Animations (Alpha),Animation,"Refine blending between animations and fix any janky movements observed during playtesting.",Lead Animator,2024-12-25,High,Internal Playtesting Session 1,Open
Polish VFX for Abilities,Art,"Enhance particle effects for special abilities and magic attacks (if any) based on playtest feedback for clarity.",VFX Artist,2024-12-25,Medium,Internal Playtesting Session 1,Open
Implement Camera Improvements,Programming,"Fine-tune camera behavior (auto-adjust, avoid clipping into walls) based on player feedback.",Gameplay Programmer,2024-12-30,High,Internal Playtesting Session 1,Open
Alpha Build Iteration 2,QA,"Release a second iteration of the alpha build incorporating fixes and improvements for further testing.",Build Engineer,2025-01-10,Critical,Log and Triage Playtest Feedback,Open
Alpha Player Progression Balance,Game Design,"Adjust XP requirements, leveling speed, and skill unlock pacing from early playtest data.",Systems Designer,2025-01-20,Medium,Internal Playtesting Session 1,Open
Enemy Balance Adjustment (Alpha),Game Design,"Tweak enemy health/damage for balance; ensure grunt enemies aren't too easy or too hard in early levels.",Combat Designer,2025-01-20,High,Log and Triage Playtest Feedback,Open
Cutscene Timing Review,QA,"Review cutscenes in alpha build to ensure they trigger at correct times and have appropriate pacing.",QA Tester,2025-01-05,Medium,Combine and Integrate Core Features,Open
Voiceover and Subtitle QA,QA,"Verify voiceover lines are triggering correctly and subtitles match VO, check for missing lines.",QA Tester,2025-01-10,Medium,Cinematic Voiceover Integration,Open
Alpha Phase Sign-off,Production,"Confirm that alpha phase goals are met (all features in, major bugs addressed) and move to beta phase.",Project Manager,2025-01-31,Critical,"Alpha Build Iteration 2; Alpha Player Progression Balance",Open
Comprehensive Bug Sweep (Beta Start),QA,"QA team does a full playthrough to list all bugs (major and minor) to be fixed during beta.",QA Lead,2025-02-10,Critical,Alpha Phase Sign-off,Open
Fix Critical Bugs (Beta),Programming,"Address all critical/blocker bugs (crashes, progression blockers) identified in the comprehensive bug sweep.",Lead Programmer,2025-02-20,Critical,Comprehensive Bug Sweep (Beta Start),Open
Fix Major Bugs (Beta),Programming,"Address high priority issues (animation glitches, AI getting stuck, severe FPS drops) reported by QA.",Gameplay Programmer,2025-02-28,High,Comprehensive Bug Sweep (Beta Start),Open
Fix Minor Bugs (Beta),Programming,"Address lower priority bugs (texture pops, small UI misalignments, minor audio sync issues).",Gameplay Programmer,2025-03-15,Medium,Comprehensive Bug Sweep (Beta Start),Open
Collision and Physics Polishing,Programming,"Fine-tune collision boundaries and physics interactions so players and enemies don't clip through objects.",Engine Programmer,2025-03-01,High,Fix Major Bugs (Beta),Open
Final Performance Optimization,Programming,"Optimize game performance for final target platforms: frame rate stability, memory usage, and load times.",Engine Programmer,2025-03-10,Critical,Fix Major Bugs (Beta),Open
Network Stress Test (If Multiplayer),QA,"Test online play under heavy load conditions (if applicable) to ensure network code stability.",Network Programmer,2025-03-05,Low,Multiplayer Prototype (If Applicable),Open
Graphical Polish Pass,Art,"Improve or fix any visual issues: texture seams, lighting inconsistencies, pop-in, LOD transitions.",Art Director,2025-03-10,High,Comprehensive Bug Sweep (Beta Start),Open
Audio Mix Finalization,Audio,"Complete final audio mix and mastering: ensure music, sound effects, and VO are balanced and clear.",Audio Director,2025-03-15,High,Sound Mix and Volume Balancing,Open
Final QA Regression Testing,QA,"After fixes, run a regression test pass to ensure no new issues were introduced and fixed bugs stay fixed.",QA Lead,2025-03-20,Critical,"Fix Critical Bugs (Beta); Fix Major Bugs (Beta)",Open
QA Playtesting (Beta Balance),QA,"Test game balance from start to finish: difficulty curve, economy, and player progression now that most bugs are fixed.",QA Tester,2025-03-25,High,Enemy Balance Adjustment (Alpha),Open
Prepare Gold Master Build,Production,"Create the final ‘gold’ build candidate that could potentially be the release version if it passes all checks.",Build Engineer,2025-03-30,Critical,Final QA Regression Testing,Open
Final Art and Animation Tweaks,Art,"Any last-minute minor tweaks to animations or art assets that are quick and safe to do.",Lead Animator,2025-03-25,Low,Final QA Regression Testing,Open
Game Balance Final Review,Game Design,"Design team does a final review of game balance and adjusts any glaring issues (too easy/hard spots).",Lead Game Designer,2025-03-28,Medium,QA Playtesting (Beta Balance),Open
Compliance Testing (Platform Requirements),QA,"Ensure the game meets all platform certification requirements (console compliance checklists, PC settings etc.).",QA Lead,2025-04-05,Critical,Prepare Gold Master Build,Open
Address Compliance Issues,Programming,"Fix any issues found during platform compliance testing (e.g., save data handling, menu flow).",Lead Programmer,2025-04-15,High,Compliance Testing (Platform Requirements),Open
Marketing Content Finalization,Marketing,"Finalize all marketing materials such as key art, screenshots, and gameplay clips for store pages and marketing.",Marketing Manager,2025-02-28,High,Alpha Phase Sign-off,Open
Website and Social Media Launch,Marketing,"Launch the official game website and social media channels with game info, development updates, and teaser content.",Community Manager,2025-03-15,Medium,Marketing Content Finalization,Open
Plan Press and Influencer Demos,Marketing,"Schedule demo sessions or provide early builds to press and content creators to generate buzz.",PR Manager,2025-04-01,High,Prepare Gold Master Build,Open
Finalize Launch Trailer,Marketing,"Edit and produce the final game trailer highlighting story, gameplay, and visuals for launch marketing.",Video Editor,2025-03-20,Critical,Marketing Content Finalization,Open
Trailer Localization and Subtitles,Marketing,"Add subtitles or localized text to the trailer for different languages/regions as needed.",Localization Manager,2025-03-25,Medium,Finalize Launch Trailer,Open
Release Trailer Distribution,Marketing,"Distribute the final trailer to all channels (YouTube, game sites, social media) and set up ads.",Marketing Manager,2025-04-10,High,Trailer Localization and Subtitles,Open
Ratings Submission (ESRB, PEGI, etc.),Production,"Submit the game to rating boards for classification and ensure all content meets necessary guidelines.",Producer,2025-02-15,High,Alpha Phase Sign-off,Open
Release Readiness Check,Production,"Final review meeting to confirm all departments are go for launch, checklists completed.",Executive Producer,2025-04-20,Critical,"Address Compliance Issues; Release Trailer Distribution",Open
Gold Master Approval,Production,"Upon passing all tests and reviews, officially approve the Gold Master build for production/duplication.",Executive Producer,2025-04-25,Critical,Release Readiness Check,Open
Post-Launch Support Plan,Production,"Prepare a plan for day-one patch content, post-launch updates, and live support in case of issues.",Project Manager,2025-04-30,High,Release Readiness Check,Open
**Beta Phase Complete**,Production,"Mark the project as ready for launch with Gold Master approved, transition team to support and post-launch activities.",Project Manager,2025-04-30,Critical,Gold Master Approval,Open
